ator_id	titulo_id	nome_personagem	tipo	titulo	ano_lancamento	generos	nome_ator	ano_nascimento	nota	numero_votos	duracao	sinopse
nm5301405	tt11271800	Marsha	Filme	Mayday	2021	['Drama', 'Fantasia', 'Mistério']	Mia Goth	1993	4.4	2170	100.0	Uma tempestade incomum se aproxima e está prestes a mudar tudo para Ana. Depois que um curto-circuito em seu local de trabalho a transporta misteriosamente para um mundo alternativo, ela conhece uma tripulação de mulheres soldados apanhadas em uma guerra sem fim. Ao longo de uma costa estranha e acidentada, os homens enfrentam a verdade nua e crua que se esconde por trás das donzelas que parecem estar em perigo. Sob a liderança de Marsha, Ana treina como atiradora e descobre uma nova liberdade nesta irmandade desinibida. Ela logo percebe que pode não ser o assassino cruel que eles esperam, e o tempo está se esgotando para ela encontrar um caminho para casa.
nm3154303	tt11286314	Yule	Filme	Não Olhe para Cima	2021	['Comédia', 'Drama', 'Ficção Científica']	Timothée Chalamet	1995	7.2	638418	138.0	Dois astrônomos descobrem um cometa mortal vindo em direção à Terra e partem em um tour midiático para alertar a humanidade. Só que ninguém parece dar muita bola.
nm0799777	tt1133995	Sergeant Mitchell	Filme	A Caminho da Guerra	2009	['Ação', 'Suspense']	J.K. Simmons	1955	3.2	2745	90.0	Um assassino profissional treinado pelo governo americano embarca para uma missão no Oriente Médio e descobre um esquema de corrupção envolvendo a alta cúpula do governo.
nm2215143	tt11343686	Lou Simms	Série de TV	Swimming with Sharks	2022	['Drama', 'Suspense']	Kiernan Shipka	1999	6.4	2373	52.0	Quando Lou Simms(Kiernan Shipka) começa seu estágio na Fountain Pictures, ela parece uma ingênua recém-chegada a Hollywood, impressionada com a notória CEO do estúdio, Joyce Holt(Diane Kruger). Lou logo se mostra indispensável para Joyce, que não está apenas tentando manobrar seu chefe antiquado e nacionalista(Donald Sutherland), mas também ter um bebê depois de anos de tentativas. Na verdade, Lou fez uma extensa pesquisa sobre Joyce e conseguir este estágio não foi uma feliz coincidência. À medida que a obsessão de Lou cresce, ela fará de tudo para se aproximar de seu ídolo, até mesmo matar.
nm1659221	tt1137462	Jack Benjamin	Série de TV	Kings	2009	['Drama', 'Ficção Científica']	Sebastian Stan	1982	8.1	8855	60.0	Um drama fascinante sobre uma monarquia moderna, uma recontagem contemporânea da história atemporal de Davi e Golias. Esta série é uma história épica de ganância e poder, guerra e romance, amores proibidos e alianças secretas - e um jovem herói que chega ao poder em um reino moderno.
nm1684869	tt1139644	Additional Voices	Jogo	Quantum of Solace	2008	['Ação', 'Aventura', 'Suspense']	Troy Baker	1976	6.7	10224	0.0	A versão PlayStation 2 do jogo é um tiro em terceira pessoa por cima do ombro, como 007: tudo ou nada.Esta versão exclui missões como 'Miami Airport' e 'Train', mas adiciona missões como 'Docks', a parte príncipe do filme.
nm0799777	tt1142433	Roy Davies	Filme	Recém-Formada	2009	['Comédia', 'Família', 'Romance']	J.K. Simmons	1955	5.3	15391	88.0	Ryden Malby tem um plano perfeito: formar-se na faculdade, arrumar um ótimo emprego, passear com seu melhor amigo e encontrar o cara perfeito. Mas seu plano fica hilário e completamente fora de controle quando ela é forçada a voltar a morar na casa de sua excêntrica família. Quando ela finalmente consegue o emprego dos seus sonhos, Ryden percebe que isso nada significa sem o homem dos seus sonhos... e sem as pessoas que ela ama.
nm2215143	tt11426232	Jamie Hughes	Filme	Dezesseis Facadas	2023	['Comédia', 'Terror', 'Ficção Científica']	Kiernan Shipka	1999	6.5	62085	106.0	Quando o temido 'assassino das dezesseis facadas” retorna 35 anos após sua primeira onda de assassinatos para fazer outra vítima, Jamie, de 17 anos, acidentalmente viaja de volta no tempo até 1987, determinada a deter o assassino antes que ele comece a agir.
nm2215143	tt11426232	Collette	Filme	Dezesseis Facadas	2023	['Comédia', 'Terror', 'Ficção Científica']	Kiernan Shipka	1999	6.5	62085	106.0	Quando o temido 'assassino das dezesseis facadas” retorna 35 anos após sua primeira onda de assassinatos para fazer outra vítima, Jamie, de 17 anos, acidentalmente viaja de volta no tempo até 1987, determinada a deter o assassino antes que ele comece a agir.
nm1684869	tt11444410	Sgt. Matt Baker	Jogo	Brothers in Arms: D-Day	2006	['Ação', 'Drama', 'Guerra']	Troy Baker	1976	7.1	26	0.0	Experimente a intensidade da Segunda Guerra Mundial através das histórias de sargentos Baker e Hartsock e seu esquadrão de paraquedistas durante a invasão da Normandia.Brothers in Arms D Day Day traz os jogadores o melhor dos irmãos em franquia de armas em um sistema de jogos portáteis.Os jogadores experimentam o dia D como uma águia gritando com mais táticas e ação exclusiva do sistema PSP.Agora, os jogadores podem surpreender o inimigo pela vantagem final dos tiroteios, liderando uma equipe de bombeiros durante toda a campanha da Normandia.Pela primeira vez, os jogadores também poderão liderar um time de Bazuoka, pedir seu esquadrão em um MG42 ou disparar rodadas de argamassa.Um modo cooperativo aprimorado (escaramuça) oferece aos jogadores uma campanha de 12 missões.Co-op Multiplayer (Modo Skirmish): Jogue com um amigo sobre ad hoc (sem fio) através de 12 missões de escaramuças diferentes em quatro modos de jogo diferentes através da campanha cooperativa.
nm1684869	tt11517730	Erron Black	Jogo	Mortal Kombat Mobile	2015	['Ação', 'Aventura', 'Fantasia']	Troy Baker	1976	6.0	56	0.0	Vá aqui e mergulhe na ação icônica e visceral do Mortal Kombat Mobile a qualquer momento, em qualquer lugar.Lutadores lendários de Kollect como Scorpion, Sub-Zero, Raiden e Kitana e Luta em batalhas épicas de 3v3 situadas no universo mortal kombat.Este jogo de luta e coleta de cartas visualmente impressionante tem vários modos e reintroduz personagens e tradições do legado de jogos de luta de 30 anos de Mortal Kombat.Inicie a ação hoje e prove -se no maior torneio de luta em todos os reinos!
nm1684869	tt11517730	Shinnok	Jogo	Mortal Kombat Mobile	2015	['Ação', 'Aventura', 'Fantasia']	Troy Baker	1976	6.0	56	0.0	Vá aqui e mergulhe na ação icônica e visceral do Mortal Kombat Mobile a qualquer momento, em qualquer lugar.Lutadores lendários de Kollect como Scorpion, Sub-Zero, Raiden e Kitana e Luta em batalhas épicas de 3v3 situadas no universo mortal kombat.Este jogo de luta e coleta de cartas visualmente impressionante tem vários modos e reintroduz personagens e tradições do legado de jogos de luta de 30 anos de Mortal Kombat.Inicie a ação hoje e prove -se no maior torneio de luta em todos os reinos!
nm0799777	tt1155056	Oswald Klaven	Filme	Eu Te Amo, Cara	2009	['Comédia', 'Romance']	J.K. Simmons	1955	7.0	221575	105.0	Peter Klaven (Paul Rudd) é noivo de Zooey (Rashida Jones), a mulher dos seus sonhos. Ao organizar a cerimônia de casamento ele percebe que não tem qualquer amigo mais íntimo o qual possa convidar para ser seu padrinho. Decidido a resolver a situação, ele passa a encontrar vários homens na tentativa de ter uma verdadeira amizade. É assim que conhece Sydney Fife (Jason Segel), com quem se identifica. Eles cada vez se tornam mais amigos, até que esta situação coloca em risco o próprio noivado de Peter.
nm3154303	tt11563598	Bob Dylan	Filme	Um Completo Desconhecido	2024	['Biografia', 'Drama', 'Música']	Timothée Chalamet	1995	7.4	74919	141.0	No Newport Folk Festival, em 1965, o jovem Bob Dylan sacudiu o cenário da música folclórica ao se tornar elétrico e transformar o rock na voz de uma geração, definindo um dos momentos mais transformadores da música do século XX.
nm1102577	tt11563598	Sylvie Russo	Filme	Um Completo Desconhecido	2024	['Biografia', 'Drama', 'Música']	Elle Fanning	1998	7.4	74919	141.0	No Newport Folk Festival, em 1965, o jovem Bob Dylan sacudiu o cenário da música folclórica ao se tornar elétrico e transformar o rock na voz de uma geração, definindo um dos momentos mais transformadores da música do século XX.
nm3154303	tt11563598	Desconhecido	Filme	Um Completo Desconhecido	2024	['Biografia', 'Drama', 'Música']	Timothée Chalamet	1995	7.4	74919	141.0	No Newport Folk Festival, em 1965, o jovem Bob Dylan sacudiu o cenário da música folclórica ao se tornar elétrico e transformar o rock na voz de uma geração, definindo um dos momentos mais transformadores da música do século XX.
nm1684869	tt11567244	The Godslayer	Jogo	The Pathless	2020	['Ação', 'Aventura', 'Fantasia']	Troy Baker	1976	7.7	143	0.0	The Pathless é uma aventura mítica, onde você toca como o caçador, um arqueiro qualificado que explora uma ilha amaldiçoada misteriosa com um companheiro de águia.Seu objetivo é elevar uma mortalha não natural da escuridão que atormenta o mundo.Enquanto você liga acrobaticamente através de florestas densas, você caça presa, descobrirá ruínas antigas e formará um vínculo profundo com sua águia.Mas cuidado: os espíritos perigosos também se escondem na floresta.Se você não tiver cuidado, pode se tornar o caçado.
nm3154303	tt1160419	Paul Atreides	Filme	Duna	2021	['Ação', 'Aventura', 'Drama']	Timothée Chalamet	1995	8.0	952842	155.0	Em um futuro distante, planetas são comandados por casas nobres que fazem parte de um império feudal intergalático. Paul Atreides é um jovem cuja família toma o controle do planeta deserto Arrakis, também conhecido como Duna. A única fonte da especiaria Melange, a substância mais importante do cosmos, Arrakis se mostra ser um planeta nem um pouco fácil de governar.
nm5301405	tt11703050	Mabel (segment 'I')	Filme	The House	2022	['Animação', 'Comédia', 'Drama']	Mia Goth	1993	6.8	24161	97.0	Nesta comédia de animação de humor ácido, uma família humilde, um arquiteto ansioso e uma senhoria cansada ficam presos à mesma casa misteriosa em épocas diferentes.
nm0799777	tt1183921	Donald Sinclaire	Filme	Corações Instáveis	2009	['Comédia', 'Drama']	J.K. Simmons	1955	6.8	8220	92.0	Desacreditado no amor após o término de um relacionamento, Caleb se torna um homem pessismista quanto às mulheres. No feriado de Ação de Graças, ele conhece a namorada do seu irmão mais novo, Peter, e tenta convencê-lo de que o relacionamento não irá lhe trazer nada além de dor. Ao mesmo tempo, Caleb descobre que sente uma atração pela cunhada, uma vulnerabilidade que irá gradualmente se manifestar durante o feriado.
nm4911194	tt11847410	Vada Cavell	Filme	A Vida Depois	2021	['Drama']	Jenna Ortega	2002	7.0	38531	96.0	O filme acompanha a colegial Vada em sua jornada por uma crise emocional após vivenciar uma tragédia escolar. Seu relacionamento com família e amigos, assim como sua visão do mundo, são alterados para sempre.
nm1659221	tt1186370	Harry	Filme	Jogando com Prazer	2009	['Comédia', 'Drama', 'Romance']	Sebastian Stan	1982	5.8	42651	97.0	Nikki (Ashton Kutcher) leva uma vida confortável, apenas seduzindo mulheres, e vive na casa da advogada de meia idade Samantha (Anne Heche). Um dia ele conhece Heather (Margarita Levieva), uma bela garçonete que também gosta de seduzir. Os dois passam a realizar um jogo de disputas, que os obriga a jantar em restaurantes finos e a dar festas luxuosas. Até que chega a hora em que precisam decidir entre o amor e o dinheiro.
nm0005342	tt1188729	Shepard	Filme	Pandorum	2009	['Ação', 'Terror', 'Mistério']	Norman Reedus	1969	6.7	163705	108.0	Em 500 anos a humanidade estará migrando do Planeta Terra pois ele estará morrendo. É quando dois homens acordam em uma nave espacial. Sem saber onde estão, o que estão fazendo lá e quanto tempo se passou uma sensação imediata de vazio é substituída pelo medo que logo se tornará algo inimaginável. Com as poucas lembranças de fatos passados nas suas vidas eles terão que lutar pela sobrevivência de toda a raça humana.
nm0799777	tt1193138	Bob	Filme	Amor Sem Escalas	2009	['Comédia', 'Drama', 'Romance']	J.K. Simmons	1955	7.4	355013	109.0	Ryan Bingham tem por função demitir pessoas, até que seu chefe contrata a arrogante Natalie Keener, que desenvolveu um sistema de videoconferência onde as pessoas poderão ser demitidas sem que seja necessário deixar o escritório. Este sistema, caso seja implementado, põe em risco o emprego de Ryan. Ele passa então a tentar convencê-la do erro que é sua implementação, viajando com Anna para mostrar a realidade de seu trabalho.
nm3528821	tt11932678	Angie Blackburn	Filme	O Som da Fé	2023	['Biografia', 'Drama', 'Música']	Emma Myers	2002	5.2	587	109.0	Quando a vida de um astro do rock n roll desmorona, ele precisa lutar contra seus demônios do passado para realizar sua ambição de infância de se tornar um pregador.
nm0799777	tt1196134	Ed	Filme	Enlouquecendo com a Liberdade	2010	['Comédia', 'Crime']	J.K. Simmons	1955	5.5	7295	96.0	Um homem em liberdade condicional descobre que a vida fora da prisão é muito mais insana depois que ele conhece o peculiar mundo de sua irmã.
nm1684869	tt1196942	The Guitarist	Jogo	Guitar Hero: World Tour	2008	['Família', 'Música']	Troy Baker	1976	7.4	1090	0.0	Guitar Hero: World Tour é o quarto jogo principal da série e traz uma grande mudança no conceito.Após o lançamento da Rock Band, que construiu o conceito de Guitar Hero, mas adicionou instrumentos adicionais, a World Tour também os apresenta para permitir que os jogadores tocem juntos simultaneamente como uma banda real.Ao lado do violão que era o principal periférico para os títulos anteriores, a edição do jogo acrescenta um microfone para as partes vocais e bateria para percussão.Assim como o jogo anterior, as faixas de guitarra são divididas pela liderança e baixo.A letra e o arremesso vocal são mostrados perto da parte superior da tela, enquanto a parte inferior é dividida para baixo, guitarra e bateria, cada um com um conjunto separado de notas que precisam ser atingidas para desempenhar corretamente o papel.
nm0799777	tt1198194	President Howard T. Ackerman	Jogo	Command & Conquer: Red Alert 3	2008	['Ação', 'Ficção Científica', 'Guerra']	J.K. Simmons	1955	7.6	2311	0.0	Command & Conquister: Red Alert 3 está em uma realidade alternativa da Segunda Guerra Mundial, na qual os aliados ocidentais lutaram contra a União Soviética.Em Red Alert 3, a liderança soviética, enfrentando a derrota, volta no tempo para matar Albert Einstein e impedir sua assistência aos aliados, abrindo caminho para a dominação soviética no presente.No entanto, como uma conseqüência não intencional, é criada um terceiro poder mundial, o império do sol nascente, é criado e todos os três lados vão para a guerra.
nm1684869	tt12013106	Abel Nightroad	Filme	Trinity Blood: Genesis	2006	['Ação', 'Animação', 'Drama']	Troy Baker	1976	6.9	20	90.0	Lançamento do longa-metragem nos cinemas americanos para promover a série de TV Trinity Blood (2005). O filme foi feito a partir da combinação dos quatro primeiros episódios da série.
nm2215143	tt12024308	Bea Johnson	Filme	Uma Família Extraordinária	2022	['Comédia', 'Drama']	Kiernan Shipka	1999	6.8	4784	105.0	A história de Bea Johnson desde o seu nascimento até a formatura enquanto ela navega pela vida com pais que possuem deficiência intelectual e uma família extensa que não consegue chegar a um acordo sobre a melhor maneira de ajuda-la.
nm1684869	tt12093878	Batman	Vídeo	LEGO DC Shazam: Magia e Monstros	2020	['Ação', 'Aventura', 'Animação']	Troy Baker	1976	6.2	1324	81.0	Billy Batson, um garoto de 10 anos de idade, grita uma única palavra e, com raios piscando, ele se transforma em Shazam!, um super-herói adulto. Não demora muito para o Super-Homem, Mulher Maravilha, Batman e toda a Liga da Justiça descobrirem e convidarem o mais sincero benfeitor a se juntar à equipe.
nm0799777	tt1212454	Mr. Jones	Filme	Matemática do Amor	2010	['Comédia', 'Drama', 'Família']	J.K. Simmons	1955	5.3	4453	96.0	Mona Gray é uma jovem de vinte anos, solitária, que decidiu por estudar matemática quando seu pai estava doente. Hoje professora, ela deseja auxiliar seus alunos em suas próprias crises.
nm1684869	tt1213669	Conan	Jogo	Age of Conan: Hyborian Adventures	2008	['Ação', 'Aventura', 'Fantasia']	Troy Baker	1976	6.8	198	0.0	Age of Conan: A Hyblustian Adventures é um jogo on-line premiado e aclamado pela crítica, multiplayer, no mundo sexy, selvagem e brutal de Conan, o bárbaro.Pise nos passos do maior herói de fantasia de todos os tempos e explore os vastos alcances de Hyboria.Escolha entre doze classes diferentes, de bárbaro a desmonologista, e lute para riquezas e glória enquanto luta contra as criaturas diretamente do inferno ou até se envolve na Guilda Colossal vs. Guild Warfare!
nm0000206	tt1220888	Henry Torne	Filme	A Ocasião Faz O Ladrão	2010	['Comédia', 'Crime', 'Drama']	Keanu Reeves	1964	5.9	21867	108.0	O modesto cobrador de pedágios Henry Torne (Keanu Reeves) é injustamente acusado de ter roubado um banco. Após ter cumprido a pena, Henry decide de fato realizar o crime. O plano é se infiltrar em um teatro para ter acesso ao túnel que o levará ao banco, mas a paixão por uma bela atriz (Vera Farmiga) poderá perturbar o seu projeto.
nm1684869	tt1223886	Major Richard Blake	Jogo	Resistance 2	2008	['Ação', 'Ficção Científica', 'Suspense']	Troy Baker	1976	7.9	1414	0.0	Após uma valente luta para impedir a invasão da Chimera na Europa, a humanidade deve fazer sua última posição nas margens dos Estados Unidos.A Resistance 2 oferece uma experiência sem precedentes de jogos de console com uma campanha cooperativa on-line de oito jogadores e de classe e 60 jogadores multiplayer on-line.Uma campanha épica de um jogador único contará com um novo arsenal de armas para combater encontros gigantes de chefe que aumentam a escala do conflito para novos patamares.
nm0799777	tt1225822	Brian	Filme	Maré de Azar	2009	['Comédia', 'Crime', 'Romance']	J.K. Simmons	1955	6.1	51173	92.0	Joel (Jason Bateman) é um botânico e empresário prestes a vender sua empresa de extração de essências e assim curtir uma bela aposentadoria. Eis que um acidente de trabalho com uma de suas funcionárias provoca uma desintegração total, levando a uma série de desastres que coloca seus negócios e sua vida pessoal em perigo.
nm3154303	tt1226837	Nic Sheff	Filme	Querido Menino	2018	['Biografia', 'Drama']	Timothée Chalamet	1995	7.4	113633	120.0	David Sheff é um conceituado jornalista e escritor que vive com a segunda esposa e os filhos. O filho mais velho, Nic Sheff, é viciado em metanfetamina e abala completamente a rotina da família e daquele lar. David tenta entender o que acontece com o filho, que teve uma infância de carinho e suporte, ao mesmo tempo em que estuda a droga e sua dependência. Nic, por sua vez, passa por diversos ciclos da vida de um dependente químico, lutando para se recuperar, mas volta e meia se entregando ao vício.
nm1684869	tt12285906	AJ	Jogo	DiRT 5	2020	['Esporte']	Troy Baker	1976	6.2	351	0.0	Dirt 5 é a nova experiência de corrida off-road, criada pelos mestres da Codemas.Blaze uma trilha nas rotas mais icônicas do mundo.Dirija a lista mais ampla de carros de ícones de rali, caminhões, heróis GT e muito mais.Jogue através de uma carreira repleta de estrelas, modos on-line inovadores e de tela dividida em quatro jogadores, editor de libré e mais novos recursos, o Dirt 5 é a próxima geração de corridas extremas.
nm3081796	tt12299608	Timo	Filme	Mickey 17	2025	['Aventura', 'Comédia', 'Fantasia']	Steven Yeun	1983	6.9	102980	137.0	Mickey faz parte de um programa espacial de colonização e sempre é enviado para missões perigosas, quase suicidas. Se morrer, ele é clonado e boa parte de suas memórias são recuperadas. Mas, após seis mortes, ele começa a entender o porquê de seu cargo nunca ter sido ocupado antes.
nm1659221	tt1231587	Blaine	Filme	A Ressaca	2010	['Comédia', 'Ficção Científica']	Sebastian Stan	1982	6.4	191722	99.0	Após viverem um tempo separados, quatro amigos juntam-se quando um deles quer se suicidar. Nenhum deles está feliz com suas vidas, então decidem ir para um resort de esqui, onde têm a oportunidade de curtirem um tempo juntos. Depois de uma noite bebendo dentro de uma banheira, eles acordam em 1986 e têm a chance de reescrever o passado.
nm1684869	tt12496734	Simon Krieger	Jogo	Spider-Man: Miles Morales	2020	['Ação', 'Aventura', 'Crime']	Troy Baker	1976	8.3	14278	0.0	A mais recente aventura no universo do Homem-Aranha se baseará e expandirá o 'Homem-Aranha da Marvel' através de uma nova história.Os jogadores experimentarão a ascensão de Miles Morales, enquanto ele domina novos poderes para se tornar seu próprio Homem-Aranha.
nm1659221	tt12573454	Max	Filme	Sharper - Uma Vida de Trapaças	2023	['Crime', 'Drama', 'Suspense']	Sebastian Stan	1982	6.7	35376	116.0	Madeline é uma golpista envolvida em trapaças do mundo dos bilionários de Manhattan, nos Estados Unidos. Enquanto isso, Max é um especialista em complexos planos fraudulentos que costumam render muito dinheiro. Juntos eles viverão uma trama cheia de traições, roubos, conflitos familiares, manipulações e jogos cruéis de poder.
nm2215143	tt12584954	Addy	Filme	Twisters	2024	['Ação', 'Aventura', 'Suspense']	Kiernan Shipka	1999	6.5	167756	122.0	Kate Cooper é uma ex-caçadora de tempestades assombrada por um encontro devastador com um tornado durante seus anos de faculdade, que agora estuda padrões de tempestades nas telas em segurança na cidade de Nova York. Ela é atraída de volta às planícies por seu amigo, Javi, para testar um novo sistema revolucionário de rastreamento. Lá, ela cruza seu caminho com Tyler Owens, o carismático e imprudente ícone das redes sociais que se diverte postando suas aventuras de caça a tempestades com sua equipe barulhenta, quanto mais perigoso melhor. À medida que a temporada de tempestades se intensifica, fenômenos aterrorizantes nunca antes vistos são desencadeados e Kate, Tyler e suas equipes concorrentes se encontram diretamente no caminho de múltiplos sistemas de tempestades convergindo sobre o centro de Oklahoma na luta de suas vidas.
nm1684869	tt12587880	Maw	Jogo	The Medium	2021	['Terror', 'Mistério', 'Suspense']	Troy Baker	1976	7.1	912	0.0	Descubra um mistério sombrio que apenas um meio pode resolver.Explore o mundo real e o mundo espiritual ao mesmo tempo.Use suas habilidades psíquicas para resolver quebra -cabeças que abrangem os dois mundos, descobrem segredos profundamente perturbadores e sobrevivem a encontros com o Maw - um monstro nascido de uma tragédia indizível.O meio é um jogo de terror psicológico em terceira pessoa que apresenta uma jogabilidade patenteada de realidade dupla e uma trilha sonora original.
nm0799777	tt12610390	Tom Brennan	Filme	A Liga	2024	['Ação', 'Comédia', 'Suspense']	J.K. Simmons	1955	5.4	52894	107.0	Recrutado para uma missão inesperada, um cara comum que trabalha como empreiteiro vira espião.
nm3480246	tt12637874	Lucy MacLean	Série de TV	Fallout	2024	['Ação', 'Aventura', 'Drama']	Ella Purnell	1996	8.3	308726	60.0	Baseada em uma das maiores séries de videogame de todos os tempos, Fallout é a história de quem tem e de quem não tem, em um mundo onde não existe quase nada para se ter. 200 anos após o apocalipse, uma habitante pacífica de um agradável refúgio é forçada a se aventurar na superfície e fica chocada quando descobre a terra devastada que a espera.
nm0799777	tt12724306	Ghat	Filme	Glorious	2022	['Terror', 'Mistério', 'Suspense']	J.K. Simmons	1955	5.6	8001	79.0	Depois de um rompimento, Wes acaba em uma parada de descanso remota. Ele se encontra trancado dentro do banheiro com uma figura misteriosa falando de uma cabine adjacente. Logo Wes percebe que está envolvido em uma situação mais terrível do que ele poderia imaginar.
nm4911194	tt12826940	Suzie	Filme	Wyrm	2019	['Comédia']	Jenna Ortega	2002	6.5	951	97.0	Em um filme alternativo dos anos 1990, com partes iguais de Yorgos Lanthimos e Todd Solondz (mas mais gentil), um jovem adolescente desajeitado deve cumprir uma exigência escolar na qual os alunos usam coleiras eletrônicas que só se soltam após o primeiro beijo.
nm1102577	tt1291566	Melody	Filme	O Desaparecimento de Sidney Hall	2017	['Drama', 'Mistério', 'Romance']	Elle Fanning	1998	6.8	12096	119.0	Ao longo de 12 anos, e três fases de sua vida, Sidney Hall se apaixona, escreve o livro de uma geração e depois desaparece sem deixar rastros. Um detetive enigmático embarca em uma viagem para descobrir o mistério.
nm0604742	tt1291570	Joe Merriwether	Filme	Presságios de um Crime	2015	['Crime', 'Drama', 'Mistério']	Jeffrey Dean Morgan	1966	6.4	71863	101.0	Dois detetives do FBI, Joe Merriwether e Katherine Cowles perseguem um serial killer conhecido por matar suas vítimas com um objeto perfurante na nuca, sem deixar vestígios na cena do crime. Diante da ausência de provas, Joe pede ajuda ao seu amigo pessoal, o Doutor John Clancy, um poderoso vidente que vive isolado desde a morte de sua filha. Aos poucos, este novo investigador ajuda os policiais a entender a mente do assassino, até fazer uma descoberta importante: o homem responsável pelas mortes também é um vidente, ainda mais esperto que John. Pior do que isso, ele está sempre um passo à frente nas investigações.
nm1684869	tt1295906	Sol Badguy	Jogo	Guilty Gear 2: Overture	2007	['Ação', 'Fantasia', 'Ficção Científica']	Troy Baker	1976	5.5	28	0.0	Dois sistemas de jogos completamente diferentes realizados em um ambiente em tempo real em tempo real.Seja o comandante de suas tropas, e também seja o herói da linha de frente do seu exército, lutando contra as forças inimigas de frente enquanto distribui comandos!
