ator_id	titulo_id	nome_personagem	tipo	titulo	ano_lancamento	generos	nome_ator	ano_nascimento	nota	numero_votos	duracao	sinopse
nm1684869	tt3334704	Samuel Drake	Jogo	Uncharted 4: A Thief's End	2016	['Ação', 'Aventura', 'Drama']	Troy Baker	1976	9.4	39491	0.0	Vários anos após sua última aventura, a Fortune Hunter aposentada, Nathan Drake, é forçada a voltar ao mundo dos ladrões.Com as apostas muito mais pessoais, Drake embarca em uma jornada de trote do mundo em busca de uma conspiração histórica por trás de um lendário tesouro pirata.Sua maior aventura testará seus limites físicos, sua determinação e, finalmente, o que ele está disposto a sacrificar para salvar os que ele ama.
nm5301405	tt33764258	Desconhecido	Filme	A Odisseia	2026	['Ação', 'Aventura', 'Fantasia']	Mia Goth	1993	0.0	0	0.0	Uma adaptação do poema de Homero de mesmo nome. Filmado em todo o mundo, este épico de ação mítico segue Odisseu enquanto ele embarca em uma jornada de 10 anos para casa após a Guerra de Troia, encontrando deuses, monstros e desafios sem fim, tudo isso enquanto tenta se reunir com sua esposa e recuperar seu reino.
nm2794962	tt3397754	Eliza	Filme	Drama em Familia	2015	['Comédia', 'Drama', 'Música']	Hailee Steinfeld	1996	5.9	6104	113.0	Na véspera do ano novo de 1987, Jude (Asa Butterfield) conhece Eliza (Hailee Steinfeld), uma garota de Nova York que se envolve com Teddy (Avan Jogia), o melhor amigo de Jude. Naquela noite, Teddy morre de overdose e Jude passa por um forte momento de luto, o que leva sua família a enviá-lo para morar com o pai, Les (Ethan Hawke) em Nova York. Lá, seu destino cruza com o de Johnny (Emile Hirsch), o meio irmão de Teddy, e, novamente, com o de Eliza, que engravidou naquela fatídica noite. Agora, os três jovens vão acabar se unindo para formar uma família para o filho de Teddy.
nm3154303	tt3416536	Daniel	Filme	Noites Quentes de Verão	2017	['Crime', 'Drama', 'Romance']	Timothée Chalamet	1995	6.4	25504	107.0	No verão de 1991, um adolescente atinge a maioridade durante um verão que ele passa em Cape Cod ficando rico vendendo maconha para gângsteres, se apaixonando pela primeira vez, festejando e acaba percebendo que está perdendo a cabeça.
nm1684869	tt3468818	Joel	Jogo	The Last of Us: Left Behind	2014	['Ação', 'Aventura', 'Drama']	Troy Baker	1976	8.9	13633	0.0	Deixado para trás está o primeiro DLC para o jogo de terror de sobrevivência aclamado pela crítica The Last of Us, desenvolvido por Naughty Dog.
nm1684869	tt3485722	Additional Voices	Jogo	The Elder Scrolls Online	2014	['Ação', 'Aventura', 'Drama']	Troy Baker	1976	7.4	1837	0.0	Experimente uma história em constante expansão em todo o Tamriel no The Elder Scrolls Online, um RPG on-line premiado.Explore um mundo rico e vivo com amigos ou embarque em uma aventura solo.Desfrute do controle completo sobre como seu personagem se parece e pega, desde as armas que você usa até as habilidades que aprende - as escolhas que você faz moldarão seu destino.Bem -vindo a um mundo sem limites.
nm2581521	tt3496372	Noah Henry	Filme	A Casa do Medo	2015	['Drama', 'Terror', 'Mistério']	Austin Butler	1991	4.5	3877	92.0	Uma adolescente perturbada, com um histórico de doença mental, se muda para uma nova casa com o pai. Logo, ela começa a experimentar estranhas ocorrências aparentemente sobrenaturais dentro de sua casa.
nm0000206	tt34984490	Shadow	Curta	Um Natal Ouriçado	2024	['Animação', 'Comédia', 'Família']	Keanu Reeves	1964	6.5	199	2.0	Um Papai Noel ferido visita Sonic, Tails e Knuckles. Como ele não consegue entregar presentes, ele envia a Equipe Sonic para entregar todos os presentes de Natal para todos ao redor do mundo.
nm1659221	tt3498820	Bucky Barnes	Filme	Capitão América: Guerra Civil	2016	['Ação', 'Ficção Científica']	Sebastian Stan	1982	7.8	886245	147.0	Depois do ataque de Ultron, os políticos decidem controlar os Vingadores, já que suas ações afetam toda a humanidade. A decisão coloca o Capitão América em rota de colisão com o Homem de Ferro.
nm1659221	tt3498820	Winter Soldier	Filme	Capitão América: Guerra Civil	2016	['Ação', 'Ficção Científica']	Sebastian Stan	1982	7.8	886245	147.0	Depois do ataque de Ultron, os políticos decidem controlar os Vingadores, já que suas ações afetam toda a humanidade. A decisão coloca o Capitão América em rota de colisão com o Homem de Ferro.
nm1684869	tt34996171	Desconhecido	Jogo	Intergalactic: The Heretic Prophet	2027	['Ação', 'Ficção Científica']	Troy Baker	1976	0.0	0	0.0	Definir milhares de anos no futuro, intergaláctico: o profeta heretic coloca os jogadores no papel de Jordan A. Mun, um perigoso caçador de recompensas que acaba preso na Sempiria - um planeta distante cuja comunicação com o universo externo ficou sombrio centenas de anos atrás.Jordan terá que usar todas as suas habilidades e inteligência se espera ser a primeira pessoa em mais de 600 anos a deixar sua órbita.
nm0000206	tt3503406	Ramsey	Filme	Versões de um Crime	2016	['Crime', 'Drama', 'Mistério']	Keanu Reeves	1964	6.2	35344	93.0	Um adolescente é acusado de assassinar o pai rico. Um advogado é encarregado de defendê-lo no tribunal e revelar a verdade por trás do crime. À medida que investiga, descobre que a mãe do garoto está ocultando diversos fatos essenciais ao caso.
nm1684869	tt3518070	Jetfire	Jogo	Transformers Universe	2014	['Ação', 'Ficção Científica']	Troy Baker	1976	6.5	35	0.0	O Universo Transformers era um jogo de batalha online multiplayer de terceira pessoa (MOBA).O jogo foi apresentado oficialmente no Botcon 2011. O jogo foi fechado para a versão beta em março de 2014 e entrou no Open Beta em 4 de julho de 2014. Foi encerrado em 31 de janeiro de 2015, nunca deixando a fase de teste beta
nm1684869	tt3518070	Slingshot	Jogo	Transformers Universe	2014	['Ação', 'Ficção Científica']	Troy Baker	1976	6.5	35	0.0	O Universo Transformers era um jogo de batalha online multiplayer de terceira pessoa (MOBA).O jogo foi apresentado oficialmente no Botcon 2011. O jogo foi fechado para a versão beta em março de 2014 e entrou no Open Beta em 4 de julho de 2014. Foi encerrado em 31 de janeiro de 2015, nunca deixando a fase de teste beta
nm1684869	tt3518070	Hook	Jogo	Transformers Universe	2014	['Ação', 'Ficção Científica']	Troy Baker	1976	6.5	35	0.0	O Universo Transformers era um jogo de batalha online multiplayer de terceira pessoa (MOBA).O jogo foi apresentado oficialmente no Botcon 2011. O jogo foi fechado para a versão beta em março de 2014 e entrou no Open Beta em 4 de julho de 2014. Foi encerrado em 31 de janeiro de 2015, nunca deixando a fase de teste beta
nm1684869	tt3554580	Arkham Knight	Jogo	Batman: Arkham Knight	2015	['Ação', 'Crime', 'Mistério']	Troy Baker	1976	9.0	26316	0.0	Com as costas contra a parede, Batman se vira para seus aliados mais próximos para ajudá -lo a salvar a cidade de Gotham das garras de Scarecrow e do exército de Arkham Knight.Um rosto familiar também retorna para dar uma mensagem ao Cavaleiro das Trevas que ele não pode ignorar.
nm1684869	tt3554580	Jason Todd	Jogo	Batman: Arkham Knight	2015	['Ação', 'Crime', 'Mistério']	Troy Baker	1976	9.0	26316	0.0	Com as costas contra a parede, Batman se vira para seus aliados mais próximos para ajudá -lo a salvar a cidade de Gotham das garras de Scarecrow e do exército de Arkham Knight.Um rosto familiar também retorna para dar uma mensagem ao Cavaleiro das Trevas que ele não pode ignorar.
nm1684869	tt3554580	Red Hood	Jogo	Batman: Arkham Knight	2015	['Ação', 'Crime', 'Mistério']	Troy Baker	1976	9.0	26316	0.0	Com as costas contra a parede, Batman se vira para seus aliados mais próximos para ajudá -lo a salvar a cidade de Gotham das garras de Scarecrow e do exército de Arkham Knight.Um rosto familiar também retorna para dar uma mensagem ao Cavaleiro das Trevas que ele não pode ignorar.
nm3154303	tt35616060	Self	Filme	Hans Zimmer & Friends: Diamond in the Desert	2025	['Música']	Timothée Chalamet	1995	8.7	742	158.0	Uma viagem por Dubai com apresentações ao vivo na Coca-Cola Arena, conversas íntimas com amigos e momentos deslumbrantes pelas dunas do deserto e pelo icônico Burj Al Arab.
nm3528821	tt3566834	Natalie	Filme	Um Filme Minecraft	2025	['Ação', 'Aventura', 'Comédia']	Emma Myers	2002	5.9	67786	101.0	Quatro desajustados enfrentam problemas comuns do dia a dia quando, de repente, são sugados por um portal misterioso para o Overworld: uma terra fascinante e cúbica, movida pela imaginação. Para voltarem para casa, eles precisarão dominar esse novo mundo enquanto embarcam em uma jornada mágica ao lado de um crafter experiente e inesperado: Steve.
nm1684869	tt3587730	Jazz	Jogo	Transformers: Rise of the Dark Spark	2014	['Ação', 'Aventura', 'Crime']	Troy Baker	1976	5.6	288	0.0	Jogue como seus personagens favoritos dos 4º universos de filme Transformers e Cybertron!
nm1684869	tt3587730	Jetfire	Jogo	Transformers: Rise of the Dark Spark	2014	['Ação', 'Aventura', 'Crime']	Troy Baker	1976	5.6	288	0.0	Jogue como seus personagens favoritos dos 4º universos de filme Transformers e Cybertron!
nm1684869	tt3587730	Kickback	Jogo	Transformers: Rise of the Dark Spark	2014	['Ação', 'Aventura', 'Crime']	Troy Baker	1976	5.6	288	0.0	Jogue como seus personagens favoritos dos 4º universos de filme Transformers e Cybertron!
nm1684869	tt3590472	Dragon	Jogo	Lichdom: Battlemage	2014	['Ação']	Troy Baker	1976	5.2	39	0.0	Lichdom: Battlemage é um lançador de primeira pessoa que dá ao mago os holofotes de uma maneira nunca antes visto nos jogos.Com o poder mágico ilimitado à sua disposição e inimigos brutais ao redor de cada esquina, a vitória depende de uma combinação de habilidade e estratégia.Você deve criar cuidadosamente uma vasta gama de feitiços e aprender a lançá -los no calor do combate.
nm1684869	tt3590472	Gryphon	Jogo	Lichdom: Battlemage	2014	['Ação']	Troy Baker	1976	5.2	39	0.0	Lichdom: Battlemage é um lançador de primeira pessoa que dá ao mago os holofotes de uma maneira nunca antes visto nos jogos.Com o poder mágico ilimitado à sua disposição e inimigos brutais ao redor de cada esquina, a vitória depende de uma combinação de habilidade e estratégia.Você deve criar cuidadosamente uma vasta gama de feitiços e aprender a lançá -los no calor do combate.
nm1684869	tt3596004	Alex Taylor	Jogo	The Crew	2014	['Ação', 'Aventura', 'Crime']	Troy Baker	1976	6.7	675	0.0	Depois que seu irmão é assassinado, Alex se une a um agente do FBI para derrubar o homem que matou seu irmão e um agente corrupto.
nm0000206	tt3605418	Evan Webber	Filme	Bata Antes de Entrar	2015	['Crime', 'Suspense']	Keanu Reeves	1964	4.9	110099	99.0	Em uma noite chuvosa, duas belas mulheres batem à porta de Evan Webber (Keanu Reeves). Ele está sozinho em casa, já que a esposa e filho estão viajando. Não demora muito para que ambas o seduzam, tendo uma noite de amor com ele. Só que, no dia seguinte, elas passam a persegui-lo implacavelmente.
nm1869101	tt3605418	Bel	Filme	Bata Antes de Entrar	2015	['Crime', 'Suspense']	Ana de Armas	1988	4.9	110099	99.0	Em uma noite chuvosa, duas belas mulheres batem à porta de Evan Webber (Keanu Reeves). Ele está sozinho em casa, já que a esposa e filho estão viajando. Não demora muito para que ambas o seduzam, tendo uma noite de amor com ele. Só que, no dia seguinte, elas passam a persegui-lo implacavelmente.
nm1659221	tt3623726	Josh	Filme	Ricki and the Flash: De Volta pra Casa	2015	['Comédia', 'Drama', 'Música']	Sebastian Stan	1982	6.0	25426	101.0	Com mais de 50 anos de idade, Ricki é uma cantora de rock, que sempre se apresenta com a banda The Flash em um pequeno bar. A situação financeira é precária, e ela não vê os filhos adultos há décadas. Um dia, o ex-marido Pete liga para Ricki, avisando que a filha Julie foi abandonada pelo marido, e pedindo ajuda para tirá-la de um estado depressivo. Reticente, a mãe retorna ao lar, e descobre que tanto Julie quanto seus dois irmãos têm muito ressentimento por causa do abandono quando eram crianças. Essa é a oportunidade para Ricki fazer as pazes e tentar ser mais presente na vida deles.
nm1659221	tt3659388	Chris Beck	Filme	Perdido em Marte	2015	['Aventura', 'Drama', 'Ficção Científica']	Sebastian Stan	1982	8.0	965931	144.0	O astronauta Mark Watney é enviado a uma missão em Marte. Após uma severa tempestade ele é dado como morto, abandonado pelos colegas e acorda sozinho no misterioso planeta com escassos suprimentos, sem saber como reencontrar os companheiros ou retornar à Terra.
nm1684869	tt3682184	Sergey Plotnikov	Vídeo	Scooby-Doo! Jogos Assombrados	2012	['Animação', 'Mistério']	Troy Baker	1976	6.5	489	22.0	Scooby e a turma têm a chance de competir nos jogos mundiais de Londres, mas quando uma estátua antiga ganha vida, pode acabar com o jogo.
nm2581521	tt3704428	Elvis	Filme	Elvis	2022	['Biografia', 'Drama', 'Música']	Austin Butler	1991	7.3	250176	159.0	Desde sua ascensão ao estrelato, o ícone do rock Elvis Presley mantém um relacionamento complicado com seu enigmático empresário, Tom Parker, por mais de 20 anos.
nm1684869	tt3712498	Deadeye Brightland	Jogo	WildStar	2014	['Ação', 'Aventura', 'Ficção Científica']	Troy Baker	1976	7.6	70	0.0	Criticamente aclamada e agora livre para tocar, o WildStar é um MMO de ficção científica fantástico, onde você pode se juntar a seus amigos ou realizar suas próprias aventuras épicas no lendário planeta nexo!Servidores para Wildstar fecharam oficialmente em 28 de novembro de 2018.
nm1684869	tt3712498	Kevo	Jogo	WildStar	2014	['Ação', 'Aventura', 'Ficção Científica']	Troy Baker	1976	7.6	70	0.0	Criticamente aclamada e agora livre para tocar, o WildStar é um MMO de ficção científica fantástico, onde você pode se juntar a seus amigos ou realizar suas próprias aventuras épicas no lendário planeta nexo!Servidores para Wildstar fecharam oficialmente em 28 de novembro de 2018.
nm1684869	tt3712498	Exile Male	Jogo	WildStar	2014	['Ação', 'Aventura', 'Ficção Científica']	Troy Baker	1976	7.6	70	0.0	Criticamente aclamada e agora livre para tocar, o WildStar é um MMO de ficção científica fantástico, onde você pode se juntar a seus amigos ou realizar suas próprias aventuras épicas no lendário planeta nexo!Servidores para Wildstar fecharam oficialmente em 28 de novembro de 2018.
nm1684869	tt3742988	Pagan Min	Jogo	Far Cry 4	2014	['Ação', 'Aventura', 'Crime']	Troy Baker	1976	8.0	12125	0.0	Para cumprir o desejo moribundo de sua mãe, Ajay Ghale viaja a Kyrat para espalhar suas cinzas.Antes que ele possa conseguir isso, ele deve terminar uma guerra civil entre o caminho de ouro e as forças de Min.
nm1684869	tt3757728	Batman	Jogo	Lego Batman 3: Beyond Gotham	2014	['Ação', 'Aventura', 'Animação']	Troy Baker	1976	7.5	2294	0.0	O Cruzader Caped une forças com os super -heróis do universo de quadrinhos da DC e explode no espaço sideral para impedir que o malacto Brainiac destruísse a Terra.
nm1684869	tt3757728	Bruce Wayne	Jogo	Lego Batman 3: Beyond Gotham	2014	['Ação', 'Aventura', 'Animação']	Troy Baker	1976	7.5	2294	0.0	O Cruzader Caped une forças com os super -heróis do universo de quadrinhos da DC e explode no espaço sideral para impedir que o malacto Brainiac destruísse a Terra.
nm1684869	tt3757728	The Atom	Jogo	Lego Batman 3: Beyond Gotham	2014	['Ação', 'Aventura', 'Animação']	Troy Baker	1976	7.5	2294	0.0	O Cruzader Caped une forças com os super -heróis do universo de quadrinhos da DC e explode no espaço sideral para impedir que o malacto Brainiac destruísse a Terra.
nm5700898	tt3766340	Liza	Filme	Liza, Liza, Skies Are Grey	2015	['Drama']	Mikey Madison	1999	5.5	137	86.0	Uma viagem de motocicleta pela Califórnia, na passagem da adolescência, ambientada nos anos 60, combinando elementos de 'Romeu e Julieta' e 'A Odisseia'.
nm1684869	tt3772796	Shinnok	Jogo	Mortal Kombat X	2015	['Ação', 'Aventura', 'Fantasia']	Troy Baker	1976	8.2	5204	0.0	Mortal Kombat X é o décimo jogo principal da série de luta individual e uma sequência do título de 2011 Mortal Kombat.O jogo permanece próximo ao estilo visual e à mecânica da reinicialização de 2011.Os principais controles ainda são baseados em dois tipos de socos e chutes, e bloqueando, para formar combos com uppercuts, teleports, movimentos especiais que incorporam armas e fatalidades.A energia de três camadas do título anterior retorna, disponibilizando movimentos de raios-x disponíveis, movimentos ex-movimentos e disjuntores combinados.Conforme introduzido em injustiça: deuses entre nós, os personagens podem usar o ambiente para se reposicionar ou opcionalmente usar peças como armas.Cada personagem agora tem três variações com diferentes movimentos e armas.Há mais uma vez um medidor de corrida, retornando do mortal Kombat 4.
nm1684869	tt3772796	Erron Black	Jogo	Mortal Kombat X	2015	['Ação', 'Aventura', 'Fantasia']	Troy Baker	1976	8.2	5204	0.0	Mortal Kombat X é o décimo jogo principal da série de luta individual e uma sequência do título de 2011 Mortal Kombat.O jogo permanece próximo ao estilo visual e à mecânica da reinicialização de 2011.Os principais controles ainda são baseados em dois tipos de socos e chutes, e bloqueando, para formar combos com uppercuts, teleports, movimentos especiais que incorporam armas e fatalidades.A energia de três camadas do título anterior retorna, disponibilizando movimentos de raios-x disponíveis, movimentos ex-movimentos e disjuntores combinados.Conforme introduzido em injustiça: deuses entre nós, os personagens podem usar o ambiente para se reposicionar ou opcionalmente usar peças como armas.Cada personagem agora tem três variações com diferentes movimentos e armas.Há mais uma vez um medidor de corrida, retornando do mortal Kombat 4.
nm1684869	tt3772796	Fujin	Jogo	Mortal Kombat X	2015	['Ação', 'Aventura', 'Fantasia']	Troy Baker	1976	8.2	5204	0.0	Mortal Kombat X é o décimo jogo principal da série de luta individual e uma sequência do título de 2011 Mortal Kombat.O jogo permanece próximo ao estilo visual e à mecânica da reinicialização de 2011.Os principais controles ainda são baseados em dois tipos de socos e chutes, e bloqueando, para formar combos com uppercuts, teleports, movimentos especiais que incorporam armas e fatalidades.A energia de três camadas do título anterior retorna, disponibilizando movimentos de raios-x disponíveis, movimentos ex-movimentos e disjuntores combinados.Conforme introduzido em injustiça: deuses entre nós, os personagens podem usar o ambiente para se reposicionar ou opcionalmente usar peças como armas.Cada personagem agora tem três variações com diferentes movimentos e armas.Há mais uma vez um medidor de corrida, retornando do mortal Kombat 4.
nm1684869	tt3782832	Rhys	Jogo	Tales from the Borderlands	2014	['Aventura', 'Comédia', 'Ficção Científica']	Troy Baker	1976	8.8	4647	0.0	Contos do Borderlands são uma série de jogos episódicos de cinco partes.Situado no mundo implacável de Pandora após os eventos vistos em Borderlands 2, esta é uma história cheia do humor de marca registrada de Borderlands, seguindo dois aventureiros em sua busca pela grandeza.
nm1684869	tt3782832	Tommy	Jogo	Tales from the Borderlands	2014	['Aventura', 'Comédia', 'Ficção Científica']	Troy Baker	1976	8.8	4647	0.0	Contos do Borderlands são uma série de jogos episódicos de cinco partes.Situado no mundo implacável de Pandora após os eventos vistos em Borderlands 2, esta é uma história cheia do humor de marca registrada de Borderlands, seguindo dois aventureiros em sua busca pela grandeza.
nm1684869	tt3782832	Additional Voices	Jogo	Tales from the Borderlands	2014	['Aventura', 'Comédia', 'Ficção Científica']	Troy Baker	1976	8.8	4647	0.0	Contos do Borderlands são uma série de jogos episódicos de cinco partes.Situado no mundo implacável de Pandora após os eventos vistos em Borderlands 2, esta é uma história cheia do humor de marca registrada de Borderlands, seguindo dois aventureiros em sua busca pela grandeza.
nm0799777	tt3783958	Bill	Filme	La La Land: Cantando Estações	2016	['Comédia', 'Drama', 'Música']	J.K. Simmons	1955	8.0	716667	128.0	O pianista Sebastian conhece a atriz Mia, e os dois se apaixonam perdidamente. Em busca de oportunidades para suas carreiras na competitiva Los Angeles, os jovens tentam fazer o relacionamento amoroso dar certo, enquanto perseguem fama e sucesso.
nm1684869	tt3803962	Delsin	Jogo	inFamous: First Light	2014	['Ação', 'Aventura', 'Drama']	Troy Baker	1976	7.3	1567	0.0	Utilizando seus incríveis poderes de néon, buscar estrelas em infame: First Light, um minigame independente que corre sobre o impressionante motor infame: segundo filho.O jogo se baseia em eventos do segundo filho, mas pode ser jogado sem a necessidade de comprar o jogo original.
nm0000206	tt3810192	Johnny Silverhand	Jogo	Cyberpunk 2077	2020	['Ação', 'Crime', 'Drama']	Keanu Reeves	1964	8.5	18273	0.0	Em Night City, um mercenário conhecido como V navega em uma sociedade distópica, onde as linhas entre humanidade e tecnologia são borradas.
nm0799777	tt3830016	Tenzin	Jogo	The Legend of Korra	2014	['Ação', 'Aventura', 'Fantasia']	J.K. Simmons	1955	7.3	509	0.0	The Legend of Korra é uma ação de terceira pessoa venceu o videogame.Os jogadores controlam Korra, a heroína da série.O Korra pode alternar entre quatro elementos diferentes em tempo real, cada um com seus próprios estilos de combate e movimentos especiais.
nm2215143	tt3830016	Jinora	Jogo	The Legend of Korra	2014	['Ação', 'Aventura', 'Fantasia']	Kiernan Shipka	1999	7.3	509	0.0	The Legend of Korra é uma ação de terceira pessoa venceu o videogame.Os jogadores controlam Korra, a heroína da série.O Korra pode alternar entre quatro elementos diferentes em tempo real, cada um com seus próprios estilos de combate e movimentos especiais.
nm2581521	tt3838992	Hunter Calloway	Filme	Guerreiras Da Yoga	2016	['Ação', 'Comédia', 'Terror']	Austin Butler	1991	4.3	16070	88.0	Colleen Collette e Colleen McKenzie, duas jovens estudantes e funcionárias de uma loja de conveniência em Manitoba, se veem frente a um mal antigo que se ergue sob o solo canadense, ameaçando o convite das amigas-xarás para uma aguardada festa. Para combater esse inimigo, as Colleens irão unir suas forças com ninguém menos que a lenda Guy Lapointe.
nm1684869	tt3849578	Brock	Jogo	Skylanders: Trap Team	2014	['Ação', 'Família', 'Fantasia']	Troy Baker	1976	7.4	421	0.0	Na equipe Skylanders Trap, Kaos continua sua busca contínua para governar sobre Skylands.Ele descobriu a localização da lendária prisão de Cloudcracker - uma fortaleza construída inteiramente a partir da substância mágica Traptanium e lar de Baddies mais nefastos de Skylands.Na tentativa de construir seu próprio exército de inimigos, Kaos explode a prisão, liberando os vilões mais procurados e explodindo fragmentos de traptanium na Terra na forma de armadilhas.Agora, cabe aos Masters do Portal recuperar todos os vilões escapados, usando poderosas armadilhas de trapânio e derrotar o Kaos antes que seja tarde demais!Os portos 3DS dos quatro primeiros jogos de Skylanders são completamente diferentes de seus colegas de console doméstico em termos de jogabilidade e história.
nm1684869	tt3849578	Rattle Shake	Jogo	Skylanders: Trap Team	2014	['Ação', 'Família', 'Fantasia']	Troy Baker	1976	7.4	421	0.0	Na equipe Skylanders Trap, Kaos continua sua busca contínua para governar sobre Skylands.Ele descobriu a localização da lendária prisão de Cloudcracker - uma fortaleza construída inteiramente a partir da substância mágica Traptanium e lar de Baddies mais nefastos de Skylands.Na tentativa de construir seu próprio exército de inimigos, Kaos explode a prisão, liberando os vilões mais procurados e explodindo fragmentos de traptanium na Terra na forma de armadilhas.Agora, cabe aos Masters do Portal recuperar todos os vilões escapados, usando poderosas armadilhas de trapânio e derrotar o Kaos antes que seja tarde demais!Os portos 3DS dos quatro primeiros jogos de Skylanders são completamente diferentes de seus colegas de console doméstico em termos de jogabilidade e história.
nm1684869	tt3849578	Sunburn	Jogo	Skylanders: Trap Team	2014	['Ação', 'Família', 'Fantasia']	Troy Baker	1976	7.4	421	0.0	Na equipe Skylanders Trap, Kaos continua sua busca contínua para governar sobre Skylands.Ele descobriu a localização da lendária prisão de Cloudcracker - uma fortaleza construída inteiramente a partir da substância mágica Traptanium e lar de Baddies mais nefastos de Skylands.Na tentativa de construir seu próprio exército de inimigos, Kaos explode a prisão, liberando os vilões mais procurados e explodindo fragmentos de traptanium na Terra na forma de armadilhas.Agora, cabe aos Masters do Portal recuperar todos os vilões escapados, usando poderosas armadilhas de trapânio e derrotar o Kaos antes que seja tarde demais!Os portos 3DS dos quatro primeiros jogos de Skylanders são completamente diferentes de seus colegas de console doméstico em termos de jogabilidade e história.
nm1659221	tt3859304	Lance Tucker	Filme	Medalha de Bronze	2015	['Comédia', 'Drama', 'Esporte']	Sebastian Stan	1982	6.1	13922	100.0	Em 2004, Hope Ann Gregory virou uma heroína americana depois de ganhar uma medalha de bronze para o time de ginástica feminino. Hoje em dia, ela ainda vive na sua pequena cidade natal, esquecida e amargurada. Presa ao passado, Hope deve reavaliar sua vida quando uma jovem ginasta promissora ameaça seu status de celebridade local.
